client_id,client_name,sector,contract_tier,sign_up_date,notes
C0039,Andrews Washington And Hess,payroll,premium,2023-06-18 00:00:00+00:00,Experience anything expect use manager item.
C0021,Hayes Thompson And Jones,unknown,basic,2023-06-19 00:00:00+00:00,
C0047,Vargas Jimenez,unknown,premium,2023-06-21 00:00:00+00:00,
C0031,Bean Inc,payroll,basic,2023-07-17 00:00:00+00:00,There black building today name accept career.
C0026,Leonard Gonzalez And Anthony,credit,basic,2023-07-27 00:00:00+00:00,Page where ask itself party business beautiful.
C0049,Payne Adkins And Brown,payroll,premium,2023-08-20 00:00:00+00:00,Capital I they girl get.
C0019,Whitehead Inc,services,unknown,2023-09-13 00:00:00+00:00,Something his analysis sea author left movie country mouth education.
C0028,Wolfe Llc,credit,standard,2023-09-21 00:00:00+00:00,
C0030,Carpenter Wright,services,unknown,2023-10-06 00:00:00+00:00,Deep establish student seek pattern part drop open late focus degree whom something.
C0008,Torres Marquez,credit,basic,2023-10-16 00:00:00+00:00,Already place finish price establish box buy body.
C0018,Smith And Sons,payroll,basic,2023-11-21 00:00:00+00:00,Wait bed oil hundred item.
C0027,Fitzgerald Brandt,payroll,standard,2023-11-22 00:00:00+00:00,Compare firm break use yeah lead process.
C0032,Brown French,credit,enterprise,2023-11-29 00:00:00+00:00,Purpose exactly technology leader beautiful move like.
C0055,Burton Plc,logistics,basic,2023-12-05 00:00:00+00:00,
C0010,Sosa Smith,logistics,basic,2023-12-08 00:00:00+00:00,Just experience everybody over imagine continue manager risk election wall build ask answer option ahead trial.
C0041,Warren Ryan,unknown,premium,2024-01-07 00:00:00+00:00,Let drop pressure either main actually staff.
C0033,Lowery Black,payroll,unknown,2024-01-14 00:00:00+00:00,Up score statement from his indeed stock audience produce store.
C0013,Flowers And Sons,unknown,unknown,2024-01-30 00:00:00+00:00,Son first magazine pull necessary more international machine word buy rich.
C0051,Hart Hudson And Wallace,unknown,standard,2024-01-30 00:00:00+00:00,
C0007,Conley Ramos And Barrett,unknown,unknown,2024-02-01 00:00:00+00:00,From well theory team personal.
C0009,Higgins Callahan And Coleman,unknown,premium,2024-02-12 00:00:00+00:00,Commercial better up per along adult stuff computer doctor successful just country.
C0006,Cox Ltd,retail,basic,2024-02-19 00:00:00+00:00,Accept brother student single policy direction blood imagine.
C0036,Thomas And Sons,services,basic,2024-02-26 00:00:00+00:00,Growth police ball campaign enough increase ability Mrs marriage will.
C0048,Knight And Sons,unknown,basic,2024-03-17 00:00:00+00:00,Morning total understand girl early size cell candidate her college yeah.
C0050,Shepherd Avila,unknown,basic,2024-03-31 00:00:00+00:00,West popular either leader tonight fire individual nation base all.
C0025,Morrow Llc,unknown,enterprise,2024-04-02 00:00:00+00:00,Get note operation south maybe player organization quickly same later if even cell home deal.
C0057,Tucker Miller And Watson,payroll,standard,2024-04-18 00:00:00+00:00,Difference again according fire glass three religious more issue prepare husband window just.
C0053,Figueroa Banks And Gray,logistics,premium,2024-05-08 00:00:00+00:00,
C0054,Davis Ltd,retail,unknown,2024-05-16 00:00:00+00:00,
C0022,Lee Plc,unknown,premium,2024-05-18 00:00:00+00:00,
C0059,Deleon Williams,retail,enterprise,2024-06-05 00:00:00+00:00,
C0003,Sanders Ltd,payroll,standard,2024-06-09 00:00:00+00:00,
C0035,Wilson Ferguson,payroll,standard,2024-06-12 00:00:00+00:00,
C0024,Houston Cole,payroll,enterprise,2024-06-17 00:00:00+00:00,Lead stock appear commercial push up.
C0042,Bennett Combs,credit,enterprise,2024-06-25 00:00:00+00:00,
C0017,Krause Garcia,retail,standard,2024-07-25 00:00:00+00:00,
C0002,Rush Bryant,retail,standard,2024-08-14 00:00:00+00:00,Yourself race single site moment billion article person notice.
C0011,Jones Inc,credit,enterprise,2024-08-18 00:00:00+00:00,Production close need little world land.
C0052,Smith And Sons,services,enterprise,2024-08-22 00:00:00+00:00,Bar two rule citizen act cost.
C0056,Duran Plc,unknown,basic,2024-08-29 00:00:00+00:00,Couple follow nearly buy bit term.
C0023,Henson Inc,unknown,basic,2024-10-04 00:00:00+00:00,Center look common make foot scene share decade education.
C0014,Byrd Morales,unknown,enterprise,2024-10-18 00:00:00+00:00,
C0038,Bowman Mack And Trujillo,unknown,basic,2024-11-15 00:00:00+00:00,Assume appear hair discover.
C0058,Ellis Brown And Pena,logistics,unknown,2024-11-26 00:00:00+00:00,Player throw question down relationship miss matter.
C0000,Levy Plc,credit,enterprise,2024-11-27 00:00:00+00:00,Form race left every determine small radio fish.
C0043,Alvarez Carson And Kennedy,credit,enterprise,2024-11-30 00:00:00+00:00,No nor air treatment.
C0037,Mcdaniel Jones And Huynh,services,enterprise,2024-12-09 00:00:00+00:00,Office their well series single wife foreign power physical great best field dark.
C0004,Bell Jenkins,services,enterprise,2024-12-09 00:00:00+00:00,
C0005,Esparza Travis,credit,standard,2024-12-15 00:00:00+00:00,
C0015,Horton Inc,credit,enterprise,2024-12-16 00:00:00+00:00,Your style wall true fire never hit.
C0045,Miller Arnold,credit,unknown,2025-01-01 00:00:00+00:00,Market recently three wish yard too.
C0046,Hinton Kim And Walker,services,premium,2025-01-09 00:00:00+00:00,Coach per fund everybody by fall would camera room.
C0029,Hancock Williams,logistics,basic,2025-01-10 00:00:00+00:00,Need low stand maintain second.
C0012,Vincent And Sons,unknown,basic,2025-01-23 00:00:00+00:00,Spend special right hospital none address strong.
C0034,Hamilton Inc,logistics,unknown,2025-02-10 00:00:00+00:00,
C0001,Miller And Sons,credit,standard,2025-02-12 00:00:00+00:00,
C0016,Parker Lewis,retail,basic,2025-04-11 00:00:00+00:00,
C0040,Vance Brown And Duncan,unknown,premium,2025-04-28 00:00:00+00:00,Public level town store place family room institution Democrat develop beautiful find couple.
C0044,Ho Chung And Smith,logistics,basic,2025-05-13 00:00:00+00:00,Agent book government improve family approach environmental.
C0020,Bauer Andrews,payroll,enterprise,2025-05-19 00:00:00+00:00,Wish build hit themselves some past chair big.
